{
  "schema": 1,
  "origins": ["http://127.0.0.1:5710", "https://seven.example.test"],
  "urls": [
    { "url": "https://seven.sliccy.ai/", "protected": true },
    { "url": "https://seven.sliccy.ai", "protected": true },
    { "url": "https://seven.sliccy.ai/index.html?x=1#y", "protected": true },
    { "url": "https://SEVEN.SLICCY.AI/", "protected": true },
    { "url": "https://seven.sliccy.ai:443/", "protected": true },
    { "url": "https://seven.sliccy.ai:8443/", "protected": true },
    { "url": "http://seven.sliccy.ai/", "protected": true },
    { "url": "https://main--seven.sliccy.ai/", "protected": true },
    { "url": "https://www.sliccy.ai/", "protected": true },
    { "url": "https://sliccy.ai/", "protected": true },
    { "url": "https://a.b.sliccy.ai/", "protected": true },
    { "url": "https://seven.sliccy.ai./", "protected": true },
    { "url": "https://user:secret@seven.sliccy.ai/", "protected": true },
    { "url": "https:\\\\seven.sliccy.ai\\x", "protected": true },
    { "url": "  https://seven.sliccy.ai/  ", "protected": true },
    { "url": "ht\ttps://seven.sli\nccy.ai/", "protected": true },
    { "url": "https:seven.sliccy.ai", "protected": true },
    { "url": "https:///seven.sliccy.ai/", "protected": true },
    { "url": "https://seven%2Esliccy%2Eai/", "protected": true },
    { "url": "https://seven\u3002sliccy\u3002ai/", "protected": true },
    { "url": "https://\uff53\uff45\uff56\uff45\uff4e.sliccy.ai/", "protected": true },
    { "url": "https://se\u00adven.sliccy.ai/", "protected": true },
    {
      "url": "blob:https://seven.sliccy.ai/0b9e0f6c-1f0e-4c1a-9a43-5d3f6e2c7a10",
      "protected": true
    },
    { "url": "filesystem:https://seven.sliccy.ai/temporary/notes.txt", "protected": true },
    { "url": "view-source:https://seven.sliccy.ai/", "protected": true },
    { "url": "view-source:blob:https://seven.sliccy.ai/0b9e0f6c", "protected": true },
    {
      "url": "devtools://devtools/bundled/inspector.html?ws=127.0.0.1:5711/devtools/page/AB12",
      "protected": true
    },
    { "url": "http://127.0.0.1:5710/", "protected": true },
    { "url": "http://127.0.0.1:5710", "protected": true },
    { "url": "http://2130706433:5710/", "protected": true },
    { "url": "http://0x7f.1:5710/", "protected": true },
    { "url": "blob:http://127.0.0.1:5710/0b9e0f6c", "protected": true },
    { "url": "https://seven.example.test/", "protected": true },
    { "url": "https://SEVEN.example.test:443/x", "protected": true },
    { "url": "https://seven.example.test./", "protected": true },
    { "url": "http://localhost:5710/", "protected": false },
    { "url": "http://127.0.0.1:5711/", "protected": false },
    { "url": "https://127.0.0.1:5710/", "protected": false },
    { "url": "http://127.0.0.1/", "protected": false },
    { "url": "http://seven.example.test/", "protected": false },
    { "url": "https://seven.example.test:8443/", "protected": false },
    { "url": "https://x.seven.example.test/", "protected": false },
    { "url": "https://example.test/", "protected": false },
    { "url": "https://sliccy.ai.example.com/", "protected": false },
    { "url": "https://notsliccy.ai/", "protected": false },
    { "url": "https://seven.sliccy.ai.example/", "protected": false },
    { "url": "https://sliccy.aix/", "protected": false },
    { "url": "https://sliccy-ai.example/", "protected": false },
    { "url": "https://example.com/?next=https://seven.sliccy.ai/", "protected": false },
    { "url": "https://example.com/#https://seven.sliccy.ai/", "protected": false },
    { "url": "https://seven.sliccy.ai@example.com/", "protected": false },
    { "url": "wss://seven.sliccy.ai/", "protected": false },
    { "url": "ftp://seven.sliccy.ai/", "protected": false },
    { "url": "http://5173.kernel.localhost/", "protected": false },
    { "url": "http://seven.sliccy.ai.kernel.localhost/", "protected": false },
    { "url": "https://example.com/", "protected": false },
    { "url": "about:blank", "protected": false },
    { "url": "about:srcdoc", "protected": false },
    { "url": "data:text/html,<a href=https://seven.sliccy.ai/>x</a>", "protected": false },
    { "url": "blob:null/0b9e0f6c", "protected": false },
    { "url": "blob:https://example.com/0b9e0f6c", "protected": false },
    { "url": "filesystem:https://example.com/temporary/x", "protected": false },
    { "url": "view-source:https://example.com/", "protected": false },
    { "url": "javascript:location='https://seven.sliccy.ai/'", "protected": false },
    { "url": "chrome://version/", "protected": false },
    { "url": "chrome-extension://abcdefghijklmnopabcdefghijklmnop/page.html", "protected": false },
    { "url": "file:///tmp/seven.sliccy.ai/index.html", "protected": false },
    { "url": "", "protected": false },
    { "url": "https://", "protected": false },
    { "url": "seven.sliccy.ai", "protected": false },
    { "url": "not a url", "protected": false }
  ],
  "targets": [
    { "url": "https://seven.sliccy.ai/", "protected": true },
    { "url": "https://example.com/", "protected": false },
    { "url": "https://example.com/", "previous": true, "protected": false },
    { "url": "https://example.com/", "opener": "protected", "protected": false },
    { "url": "about:blank", "protected": false },
    { "url": "about:blank", "opener": "unprotected", "protected": false },
    { "url": "about:blank", "opener": "protected", "protected": true },
    { "url": "about:blank", "opener": "unknown", "protected": true },
    { "url": "about:blank", "previous": true, "protected": true },
    { "url": "about:blank", "previous": true, "opener": "unprotected", "protected": true },
    { "url": "about:blank#top", "previous": true, "protected": true },
    { "url": "about:blank?x=1", "opener": "protected", "protected": true },
    { "url": "about:srcdoc", "previous": true, "protected": true },
    { "url": "about:srcdoc", "opener": "unprotected", "protected": false },
    { "url": "", "opener": "protected", "protected": true },
    { "url": "", "protected": false },
    { "url": "about:version", "previous": true, "protected": false },
    { "url": "data:text/html,x", "previous": true, "protected": false },
    { "url": "blob:https://seven.sliccy.ai/0b9e0f6c", "protected": true },
    { "url": "devtools://devtools/bundled/devtools_app.html", "protected": true },
    { "url": "http://127.0.0.1:5710/index.html", "protected": true },
    { "url": "http://127.0.0.1:5711/index.html", "previous": true, "protected": false }
  ],
  "cookieDomains": [
    { "domain": "sliccy.ai", "protected": true },
    { "domain": ".sliccy.ai", "protected": true },
    { "domain": "seven.sliccy.ai", "protected": true },
    { "domain": ".www.sliccy.ai", "protected": true },
    { "domain": "SLICCY.AI", "protected": true },
    { "domain": "sliccy.ai.", "protected": true },
    { "domain": "a.b.sliccy.ai", "protected": true },
    { "domain": "127.0.0.1", "protected": true },
    { "domain": "seven.example.test", "protected": true },
    { "domain": ".example.test", "protected": true },
    { "domain": "x.seven.example.test", "protected": false },
    { "domain": "other.example.test", "protected": false },
    { "domain": "notsliccy.ai", "protected": false },
    { "domain": "sliccy.ai.example", "protected": false },
    { "domain": "localhost", "protected": false },
    { "domain": "5173.kernel.localhost", "protected": false },
    { "domain": "example.com", "protected": false },
    { "domain": "", "protected": false },
    { "domain": ".", "protected": false }
  ],
  "storageKeys": [
    { "key": "https://seven.sliccy.ai/", "protected": true },
    { "key": "https://sliccy.ai/", "protected": true },
    { "key": "http://127.0.0.1:5710/", "protected": true },
    { "key": "https://widget.example/^0https://sliccy.ai", "protected": true },
    { "key": "https://seven.sliccy.ai/^31", "protected": true },
    { "key": "https://seven.sliccy.ai/^112345^267890", "protected": true },
    { "key": "https://example.com/", "protected": false },
    { "key": "https://example.com/^0https://example.org", "protected": false },
    { "key": "https://example.com/^112345^2https://sliccy.ai", "protected": false },
    { "key": "http://127.0.0.1:5711/", "protected": false },
    { "key": "", "protected": false }
  ]
}
